Enfoque,Descripción,Aplicaciones,Ventajas,Desventajas
Redes Neuronales,"Modelos inspirados en el cerebro humano, utilizados para reconocer patrones complejos y realizar tareas de clasificación.","Reconocimiento de imágenes, procesamiento de lenguaje natural, vehículos autónomos.","Capacidad de aprender representaciones complejas de los datos, escalabilidad.","Requieren grandes cantidades de datos y potencia de cómputo, difícil de interpretar."
Lógica Difusa,"Enfoque que maneja la incertidumbre y la imprecisión, permite valores de verdad intermedios entre 0 y 1.","Control de sistemas, toma de decisiones bajo incertidumbre, sistemas expertos.","Capacidad para manejar datos imprecisos, aplicabilidad en situaciones con incertidumbre.","Menor precisión en comparación con métodos estadísticos, difícil de ajustar correctamente."
Algoritmos Genéticos,"Métodos inspirados en la evolución biológica, utilizados para resolver problemas de optimización.","Optimización de rutas, diseño de sistemas, búsqueda de soluciones en grandes espacios.","Capacidad para encontrar soluciones óptimas o casi óptimas en espacios de búsqueda grandes.","Alto costo computacional, puede converger a soluciones subóptimas."
Sistemas Expertos,"Programas que emulan la toma de decisiones de un experto en un dominio específico.","Diagnóstico médico, asesoramiento financiero, análisis legal.","Capacidad de tomar decisiones expertas de manera consistente, aplicabilidad en dominios específicos.","Limitados a los conocimientos codificados, difícil de actualizar."
Aprendizaje por Refuerzo,"Método en el que un agente aprende a tomar decisiones a través de la recompensa o castigo.","Robótica, juegos, navegación autónoma.","Aprende comportamientos óptimos a través de la interacción con el entorno.","Requiere mucho tiempo para entrenar, difícil de aplicar en entornos con recompensas diferidas."
Árboles de Decisión,"Modelos que dividen los datos en subconjuntos según las características más discriminantes.","Clasificación, regresión, minería de datos.","Fácil de interpretar y visualizar, no requiere normalización de datos.","Propenso al sobreajuste, ineficaz con datos ruidosos."
Máquinas de Soporte Vectorial (SVM),"Algoritmo supervisado que encuentra el hiperplano que mejor separa las clases en un espacio de alta dimensión.","Clasificación de texto, reconocimiento de imágenes, bioinformática.","Robusto a dimensiones altas, efectivo en problemas no lineales.","Difícil de interpretar, requiere ajuste cuidadoso de parámetros."
Redes Bayesianas,"Modelos probabilísticos que representan un conjunto de variables y sus dependencias mediante un grafo dirigido acíclico.","Diagnóstico médico, predicción de riesgos, sistemas de recomendación.","Manejo eficiente de incertidumbre, capacidad de actualizar creencias con nueva información.","Requiere gran cantidad de datos para la construcción precisa, puede ser computacionalmente costoso."
Lógica de Primer Orden,"Sistema formal que permite la representación de relaciones entre objetos, utilizado en la inteligencia artificial simbólica.","Razonamiento automático, análisis de lenguaje natural, sistemas de planificación.","Capacidad para representar conocimiento complejo y realizar inferencias lógicas.","Computacionalmente costoso, difícil de manejar en dominios grandes o con incertidumbre."
Programación Genética,"Evolución de programas de computadora mediante algoritmos genéticos, utilizada para crear programas que resuelvan problemas específicos.","Optimización de funciones, descubrimiento de algoritmos, programación automática.","Capacidad para generar soluciones innovadoras, aplica principios evolutivos.","Costosa en términos de recursos computacionales, resultados pueden ser impredecibles."
Algoritmos de Colonia de Hormigas,"Optimización basada en el comportamiento colectivo de las hormigas, utilizada para encontrar caminos óptimos en grafos.","Optimización de rutas, planificación de redes, problemas de asignación.","Eficiente en la búsqueda de soluciones óptimas, adaptabilidad a problemas dinámicos.","Requiere ajuste fino de parámetros, puede ser lento en converger."
Sistemas Basados en Casos,"Método que resuelve problemas nuevos mediante la adaptación de soluciones de problemas pasados similares.","Asistencia médica, soporte técnico, recuperación de información.","Aprovecha el conocimiento existente, fácil de actualizar con nuevos casos.","Dependiente de la calidad y cantidad de casos almacenados, difícil de generalizar."
Inferencia Estadística,"Uso de métodos estadísticos para inferir patrones y hacer predicciones basadas en datos.","Análisis de datos, modelado predictivo, análisis de series temporales.","Permite el modelado de incertidumbre, se basa en principios matemáticos sólidos.","Requiere suposiciones sobre la distribución de datos, puede ser sensible a datos atípicos."
Aprendizaje No Supervisado,"Métodos que identifican patrones en datos no etiquetados, como la agrupación y reducción de dimensionalidad.","Segmentación de mercado, detección de anomalías, análisis de datos genómicos.","Descubre estructuras ocultas en los datos, útil en exploración de datos.","Difícil de evaluar, resultados a veces difíciles de interpretar."
Redes Neuronales Convolucionales (CNN),"Tipo de red neuronal diseñada para procesar datos con estructura de cuadrícula, como imágenes.","Reconocimiento de imágenes, visión por computadora, análisis de video.","Altamente efectiva en la extracción de características espaciales, estado del arte en visión por computadora.","Requiere grandes cantidades de datos y recursos computacionales, difícil de interpretar."
Redes Neuronales Recurrentes (RNN),"Tipo de red neuronal utilizada para datos secuenciales, como series temporales o texto.","Análisis de series temporales, procesamiento de lenguaje natural, traducción automática.","Captura dependencias temporales en datos secuenciales, efectiva en procesamiento de secuencias.","Difícil de entrenar debido a problemas como la explosión o desaparición del gradiente, limitada en manejo de dependencias largas."
Procesamiento de Lenguaje Natural (NLP),"Enfoque que permite a las máquinas entender, interpretar y generar lenguaje humano.","Traducción automática, chatbots, análisis de sentimientos.","Permite la interacción natural con sistemas computacionales, aplicaciones diversas en múltiples idiomas.","Desafíos en la comprensión del contexto, ambigüedad y sarcasmo, difícil de interpretar resultados."
Modelos de Markov Ocultos (HMM),"Modelo estadístico que representa sistemas donde se asume que el proceso subyacente sigue una cadena de Markov, pero está parcialmente oculto.","Reconocimiento de voz, biología computacional, modelado financiero.","Eficaz en el modelado de secuencias temporales con estados ocultos, relativamente simple de implementar.","Limitado en la capacidad de modelar dependencias de largo plazo, suposiciones restrictivas sobre las distribuciones."
Redes Neuronales Generativas Adversarias (GAN),"Modelo que consiste en dos redes neuronales que compiten entre sí para generar datos sintéticos realistas.","Generación de imágenes, creación de contenido, mejora de imágenes.","Capacidad para generar datos sintéticos muy realistas, avances significativos en la creación de contenido.","Difícil de entrenar, puede sufrir de colapso de modo, requiere ajuste cuidadoso."
Redes de Creencia Profunda,"Extensión de las redes Bayesianas, utilizadas para modelar distribuciones complejas en datos de alta dimensión.","Reconocimiento de patrones, análisis de datos genómicos, modelado predictivo.","Capacidad para manejar datos complejos y de alta dimensión, incorporan incertidumbre en las predicciones.","Alto costo computacional, difícil de interpretar y entrenar."
Optimización Bayesiana,"Método de optimización basado en la teoría de probabilidades, utilizado para ajustar hiperparámetros de modelos de IA.","Ajuste de modelos de aprendizaje automático, optimización de funciones complejas.","Eficiente en problemas donde la evaluación de la función objetivo es costosa, incorpora incertidumbre en la optimización.","Puede ser computacionalmente costosa en problemas de alta dimensionalidad."
Redes Neuronales de Crecimiento Dinámico,"Redes neuronales que pueden crecer y adaptarse durante el proceso de entrenamiento.","Procesamiento de lenguaje natural, reconocimiento de imágenes, robótica.","Capacidad para adaptarse a diferentes tipos de datos y tareas durante el entrenamiento.","Difícil de controlar el crecimiento y la complejidad de la red, puede ser costoso en términos de recursos."
Análisis de Componentes Principales (PCA),"Técnica de reducción de dimensionalidad que transforma datos en un nuevo espacio de menor dimensión.","Compresión de datos, visualización de datos, preprocesamiento de datos.","Reduce la dimensionalidad de los datos manteniendo la mayor parte de la varianza, útil en exploración de datos.","Pierde interpretabilidad de las características originales, puede no capturar toda la información relevante."
Redes Neuronales Autoencoders,"Modelos diseñados para aprender representaciones compactas y útiles de los datos de entrada.","Compresión de datos, eliminación de ruido, generación de datos sintéticos.","Capacidad para aprender representaciones no lineales de los datos, útil en reducción de dimensionalidad.","Difícil de entrenar en conjuntos de datos grandes, puede ser sensible a la configuración de hiperparámetros."
Análisis Discriminante Lineal (LDA),"Método utilizado para encontrar la combinación lineal de características que mejor separa las clases en un conjunto de datos.","Clasificación, reducción de dimensionalidad, reconocimiento de patrones.","Eficiente en la separación de clases lineales, útil en problemas de clasificación multiclase.","Limitado a problemas donde las clases son linealmente separables, puede ser sensible a datos atípicos."
Algoritmos de Reducción de Ruido,"Métodos diseñados para filtrar o reducir el ruido en conjuntos de datos, mejorando la calidad de los datos para el aprendizaje automático.","Preprocesamiento de datos, mejora de imágenes, análisis de señales.","Mejora la calidad de los datos, puede mejorar el rendimiento de los modelos de aprendizaje automático.","Puede eliminar información útil si no se configura correctamente, sensible a la elección del método de reducción."
Modelos Basados en Árboles,"Conjunto de modelos que utilizan árboles de decisión para realizar predicciones, como Random Forest y XGBoost.","Clasificación, regresión, minería de datos.","Robusto a características irrelevantes, puede manejar grandes cantidades de datos con características heterogéneas.","Propenso al sobreajuste si no se regulariza adecuadamente, difícil de interpretar en modelos complejos."
Redes de Memoria de Largo y Corto Plazo (LSTM),"Tipo de red neuronal recurrente diseñada para aprender dependencias a largo plazo en datos secuenciales.","Análisis de series temporales, procesamiento de lenguaje natural, predicción de secuencias.","Efectiva en el manejo de dependencias a largo plazo, superación de problemas de desvanecimiento del gradiente.","Difícil de entrenar, alto costo computacional, limitada en su capacidad de escalabilidad."
Optimización Estocástica,"Métodos de optimización que utilizan muestras aleatorias para aproximar soluciones óptimas en grandes espacios de búsqueda.","Ajuste de modelos de aprendizaje automático, optimización de funciones complejas.","Eficiente en la búsqueda de soluciones aproximadas en problemas de alta dimensionalidad, útil en grandes conjuntos de datos.","Puede converger a soluciones subóptimas, resultados pueden variar entre ejecuciones."
Algoritmos de Boosting,"Técnica de ensamble que combina modelos débiles para crear un modelo fuerte, mejorando la precisión.","Clasificación, regresión, minería de datos.","Mejora la precisión de predicciones, reduce el sesgo y la varianza en modelos.","Propenso al sobreajuste si no se controla adecuadamente, difícil de interpretar."
Modelos Basados en Clustering,"Métodos que agrupan datos en clusters según la similitud, como K-means y DBSCAN.","Segmentación de mercado, detección de anomalías, exploración de datos.","Identifica estructuras ocultas en los datos, útil en la exploración de datos.","Difícil de evaluar la calidad de los clusters, sensible a la elección de hiperparámetros."
Meta-Aprendizaje,"Método que aprende a aprender, utilizando experiencias pasadas para mejorar el rendimiento en nuevas tareas.","Optimización de hiperparámetros, adaptación rápida a nuevas tareas, transferencia de aprendizaje.","Capacidad para adaptarse rápidamente a nuevas tareas, mejora del rendimiento en tareas relacionadas.","Difícil de implementar, requiere grandes cantidades de datos y recursos computacionales."
Optimización Multiobjetivo,"Métodos diseñados para optimizar múltiples objetivos conflictivos simultáneamente.","Optimización de diseño, toma de decisiones, planificación de recursos.","Permite la toma de decisiones balanceadas considerando múltiples objetivos, útil en problemas reales complejos.","Difícil de encontrar soluciones óptimas, puede ser computacionalmente costoso."
Análisis de Series Temporales,"Técnicas diseñadas para analizar y modelar datos secuenciales que varían en el tiempo.","Predicción financiera, análisis de ventas, monitoreo de señales.","Capacidad para capturar tendencias y patrones temporales, útil en predicción y análisis de datos temporales.","Limitado por la calidad y cantidad de datos temporales, puede ser sensible a cambios bruscos en las series."
Modelos Basados en Gráficos,"Modelos que utilizan estructuras gráficas para representar relaciones entre variables, como redes bayesianas y grafos de conocimiento.","Análisis de redes sociales, diagnóstico médico, minería de datos.","Capacidad para modelar relaciones complejas entre variables, útil en dominios estructurados.","Difícil de construir y mantener, puede ser computacionalmente costoso en grandes grafos."
Métodos de Reducción de Dimensionalidad,"Técnicas que reducen el número de variables en un conjunto de datos, como PCA y t-SNE.","Preprocesamiento de datos, visualización de datos, compresión de datos.","Reduce la complejidad de los datos manteniendo la mayor parte de la información, útil en exploración de datos.","Puede perder información relevante si no se aplica correctamente, difícil de interpretar los resultados."
Modelos Generativos,"Modelos que aprenden la distribución subyacente de los datos para generar nuevas muestras similares, como GAN y VAE.","Generación de imágenes, síntesis de datos, creación de contenido.","Capacidad para generar datos sintéticos realistas, avances en la creación de contenido.","Difícil de entrenar, puede sufrir de problemas como el colapso de modo en GAN."
Optimización de Hiperparámetros,"Proceso de ajuste de los parámetros que controlan el comportamiento de un modelo de aprendizaje automático para mejorar su rendimiento.","Optimización de modelos, mejora del rendimiento, reducción de errores.","Mejora significativa del rendimiento de los modelos, esencial para obtener resultados óptimos.","Puede ser computacionalmente costoso, difícil de implementar de manera eficiente."
Redes de Atención,"Mecanismos que permiten a los modelos enfocar su atención en partes relevantes de la entrada, utilizados en tareas de secuencias y visión por computadora.","Traducción automática, procesamiento de lenguaje natural, reconocimiento de imágenes.","Mejora la interpretación y precisión en tareas de secuencias, útil en problemas de alineación.","Complejidad computacional, difícil de entrenar en conjuntos de datos grandes."
Optimización Convexa,"Métodos de optimización donde el problema es formulado como una función convexa, garantizando soluciones globales óptimas.","Ajuste de modelos, optimización de funciones, planificación de recursos.","Garantiza soluciones globales óptimas, eficiente en problemas convexos bien definidos.","Limitado a problemas convexos, puede no ser aplicable en problemas no lineales complejos."
Redes Neuronales de Residuals (ResNet),"Tipo de red neuronal diseñada para entrenar redes profundas sin sufrir de problemas de degradación del gradiente.","Reconocimiento de imágenes, visión por computadora, clasificación de imágenes.","Permite la formación de redes profundas sin pérdida de precisión, mejora el rendimiento en tareas de visión por computadora.","Requiere grandes cantidades de datos y recursos computacionales, difícil de interpretar."
Optimización de Swarm,"Métodos de optimización inspirados en el comportamiento colectivo de enjambres de partículas, como PSO.","Optimización de funciones, ajuste de modelos, problemas de diseño.","Eficiente en la búsqueda de soluciones óptimas en espacios de búsqueda grandes, adaptable a problemas dinámicos.","Requiere ajuste cuidadoso de parámetros, puede converger a soluciones subóptimas."
Aprendizaje por Transferencia,"Método donde un modelo entrenado en una tarea se reutiliza en una tarea relacionada, reduciendo la necesidad de datos y tiempo de entrenamiento.","Visión por computadora, procesamiento de lenguaje natural, análisis de datos genómicos.","Reduce el tiempo y los datos necesarios para entrenar nuevos modelos, mejora el rendimiento en tareas relacionadas.","Difícil de implementar si las tareas no están estrechamente relacionadas, puede sufrir de sobreajuste en la nueva tarea."
Redes de LSTM Bidireccionales,"Extensión de las LSTM que permite procesar secuencias en ambas direcciones, mejorando la captura de contexto.","Traducción automática, procesamiento de lenguaje natural, reconocimiento de voz.","Captura mejor el contexto en datos secuenciales, útil en tareas donde el contexto global es importante.","Alto costo computacional, difícil de entrenar en grandes conjuntos de datos."
Modelos de Simulación,"Modelos que simulan el comportamiento de sistemas complejos para hacer predicciones y tomar decisiones.","Planificación de recursos, simulación de procesos, modelado financiero.","Permite el análisis y la predicción en sistemas complejos y dinámicos, útil en planificación y optimización.","Puede ser costoso en términos de recursos computacionales, difícil de validar y verificar."
Optimización No Lineal,"Métodos de optimización aplicados a problemas donde las funciones objetivo o restricciones no son lineales.","Ajuste de modelos, planificación de recursos, diseño de sistemas.","Eficiente en problemas no lineales complejos, aplicable en una amplia gama de problemas reales.","Difícil de encontrar soluciones globales óptimas, puede converger a soluciones locales."
Optimización por Gradientes,"Métodos de optimización que utilizan el gradiente de la función objetivo para encontrar soluciones óptimas, como el descenso de gradiente.","Ajuste de modelos de aprendizaje automático, optimización de funciones, ajuste de hiperparámetros.","Eficiente en problemas de alta dimensionalidad, esencial en el entrenamiento de redes neuronales.","Sensibles a la elección de la tasa de aprendizaje, puede quedar atrapado en mínimos locales."
Métodos Bayesianos,"Técnicas que utilizan la probabilidad bayesiana para actualizar las creencias sobre un modelo a medida que se observa nueva evidencia.","Diagnóstico médico, predicción de riesgos, modelos predictivos.","Manejo eficiente de la incertidumbre, capacidad de actualizar creencias con nueva información.","Requiere gran cantidad de datos para la construcción precisa, puede ser computacionalmente costoso."
